[{"Password":{"Value":"vgfgfA1","StrengthNum":71.0,"StrengthText":"strong","LastReset":"2019-05-20"},"Description":"Google account","UserId":"LeoNguyen","LoginUrl":"http://www.google.com","AccountNum":"3567546fg"},{"Password":{"Value":"vgfgfA1","StrengthNum":71.0,"StrengthText":"strong","LastReset":"2019-05-24"},"Description":"Facebook account","UserId":"LeoNguyen","LoginUrl":"http://www.facebook.com","AccountNum":"56657657"},{"Password":{"Value":"98765","StrengthNum":71.0,"StrengthText":"strong","LastReset":"2019-05-12"},"Description":"Spotify account","UserId":"LeoNguyen","LoginUrl":"http://www.google.com","AccountNum":"3567546fg"}]